{
  "$schema": "http://json-schema.org/draft-04/schema#",
  "title": "JSON definition schema",
  "description": "Schema for JSON definition validation",
  "type": "object",
  "properties": {
    "id": {
      "title": "Definition ID",
      "$ref": "#/definitions/collectionName"
    },
    "isSubDocument": {
      "title": "Is sub-document",
      "type": "boolean"
    },
    "title": {
      "title": "Definition title",
      "type": "string"
    },
    "description": {
      "title": "Definition description",
      "type": "string"
    },
    "service": {
      "title": "Service definition",
      "$ref": "#/definitions/service"
    },
    "target": {
      "title": "Target definition",
      "$ref": "#/definitions/target"
    },
    "source": {
      "title": "Source list",
      "type": "array",
      "items": {
        "$ref": "#/definitions/source"
      }
    },
    "loadPackage": {
      "title": "Package name",
      "type": "string"
    },
    "dependencies": {
      "title": "Definition dependencies",
      "type": "array",
      "items": {
        "$ref": "#/definitions/collectionName"
      }
    }
  },
  "required": [
    "id",
    "target"
  ],
  "definitions": {
    "collectionName": {
      "type": "string",
      "pattern": "^[A-Z][a-zA-Z0-9_]*$"
    },
    "fieldName": {
      "type": "string",
      "pattern": "^[a-zA-Z_][a-zA-Z0-9_]*$"
    },
    "fieldExposedName": {
      "type": "string"
    },
    "fieldDefinitionName": {
      "type": "string",
      "pattern": "^[a-zA-Z_][a-zA-Z0-9_]*(\\.(0\\.)?[a-zA-Z_][a-zA-Z0-9_]*)*$"
    },
    "fieldBasicType": {
      "enum": [
        "string",
        "varchar",
        "text",
        "int",
        "bigint",
        "float",
        "double",
        "decimal",
        "datetime",
        "boolean",
        "hash",
        "object",
        "extref"
      ]
    },
    "fieldUpperType": {
      "enum": [
        "STRING",
        "VARCHAR",
        "TEXT",
        "INT",
        "BIGINT",
        "FLOAT",
        "DOUBLE",
        "DECIMAL",
        "DATETIME",
        "BOOLEAN",
        "HASH",
        "OBJECT",
        "EXTREF"
      ]
    },
    "fieldClassType": {
      "type": "string",
      "pattern": "^class:\\\\?[a-zA-Z_][a-zA-Z0-9_]*(\\\\[a-zA-Z_][a-zA-Z0-9_]*)*(\\[\\])?$"
    },
    "relationType": {
      "enum": [
        "embed",
        "ref"
      ]
    },
    "routerBase": {
      "type": "string",
      "pattern": "^\/?[a-z0-9_-]+(\/[a-z0-9_-]+)*\/?$"
    },

    "service": {
      "type": "object",
      "properties": {
        "readOnly": {
          "title": "Is service read-only",
          "type": "boolean"
        },
        "routerBase": {
          "title": "Router base path",
          "$ref": "#/definitions/routerBase"
        },
        "parent": {
          "title": "Parent service ID",
          "type": "string"
        },
        "baseController": {
          "title": "Base controller class",
          "type": "string"
        },
        "roles": {
          "title": "Role list",
          "type": "array",
          "items": {
            "type": "string"
          },
          "uniqueItems": true
        },
        "fixtureOrder": {
          "title": "Fixture order number",
          "type": "integer"
        },
        "fixtures": {
          "title": "Service fixtures",
          "type": "array",
          "items": {
            "$ref": "#/definitions/serviceFixture"
          }
        }
      },
      "additionalProperties": false
    },
    "serviceFixture": {
      "type": "object",
      "additionalProperties": true
    },

    "source": {
      "type": "object",
      "properties": {
        "type": {
          "title": "Source type",
          "$ref": "#/definitions/sourceType"
        },
        "params": {
          "title": "Source params",
          "$ref": "#/definitions/sourceParams"
        }
      },
      "required": [
        "type",
        "params"
      ],
      "additionalProperties": false
    },
    "sourceType": {
      "type": "string"
    },
    "sourceParams": {
      "type": "object",
      "properties": {},
      "additionalProperties": true
    },

    "target": {
      "type": "object",
      "properties": {
        "indexes": {
          "title": "Target indexes",
          "type": "array",
          "items": {
            "$ref": "#/definitions/targetIndex"
          }
        },
        "relations": {
          "title": "Target relations",
          "type": "array",
          "items": {
            "$ref": "#/definitions/targetRelation"
          }
        },
        "fields": {
          "title": "Target fields",
          "type": "array",
          "items": {
            "$ref": "#/definitions/targetField"
          }
        },
        "connectionName": {
          "title": "Connection name",
          "type": "string"
        },
        "collectionName": {
          "title": "Collection name",
          "$ref": "#/definitions/collectionName"
        },
        "sqlFile": {
          "title": "SQL file path",
          "type": "string"
        }
      },
      "required": [
        "fields"
      ],
      "additionalProperties": false
    },
    "targetIndex": {
      "type": "string"
    },
    "targetRelation": {
      "type": "object",
      "properties": {
        "type": {
          "title": "Relation type",
          "$ref": "#/definitions/relationType"
        },
        "collectionName": {
          "title": "Related collection name",
          "$ref": "#/definitions/collectionName"
        },
        "localProperty": {
          "title": "Local relation property",
          "$ref": "#/definitions/fieldDefinitionName"
        },
        "localValueField": {
          "title": "Local value field",
          "$ref": "#/definitions/fieldName"
        },
        "foreignProperty": {
          "title": "Foreign relation field",
          "$ref": "#/definitions/fieldName"
        }
      },
      "required": [
        "type",
        "localProperty"
      ],
      "additionalProperties": false
    },
    "targetField": {
      "type": "object",
      "properties": {
        "name": {
          "title": "Field name",
          "$ref": "#/definitions/fieldDefinitionName"
        },
        "type": {
          "title": "Field type",
          "oneOf": [
            {"$ref": "#/definitions/fieldBasicType"},
            {"$ref": "#/definitions/fieldUpperType"},
            {"$ref": "#/definitions/fieldClassType"}
          ]
        },
        "exposeAs": {
          "title": "Field title",
          "$ref": "#/definitions/fieldExposedName"
        },
        "title": {
          "title": "Field title",
          "type": "string"
        },
        "description": {
          "title": "Field description",
          "type": "string"
        },
        "length": {
          "title": "Field length",
          "type": "integer",
          "minimum": 0
        },
        "readOnly": {
          "title": "Is field read-only",
          "type": "boolean"
        },
        "required": {
          "title": "Is field required",
          "type": "boolean"
        },
        "translatable": {
          "title": "Is field translatable",
          "type": "boolean"
        },
        "constraints": {
          "title": "Field constraints",
          "type": "array",
          "items": {
            "$ref": "#/definitions/targetFieldConstraint"
          }
        },
        "collection": {
          "title": "Allowed extref collections",
          "type": "array",
          "items": {
            "oneOf": [
              {"$ref": "#/definitions/collectionName"},
              {"enum": ["*"]}
            ]
          },
          "uniqueItems": true
        },
        "explodeBy": {
          "title": "For internal usage only",
          "type": "string"
        }
      },
      "required": [
        "name",
        "type"
      ],
      "additionalProperties": false
    },
    "targetFieldConstraint": {
      "type": "object",
      "properties": {
        "name": {
          "title": "Constraint name",
          "type": "string"
        },
        "options": {
          "title": "Constraint options",
          "type": "array",
          "items": {
            "$ref": "#/definitions/targetFieldConstraintOption"
          }
        }
      },
      "required": [
        "name"
      ],
      "additionalProperties": false
    },
    "targetFieldConstraintOption": {
      "type": "object",
      "properties": {
        "name": {
          "title": "Constraint option name",
          "type": "string"
        },
        "value": {
          "title": "Constraint option value",
          "type": "string"
        }
      },
      "required": [
        "name",
        "value"
      ],
      "additionalProperties": false
    }
  },
  "additionalProperties": false
}
