{
    "id": "Showcase",
    "description": "A service showcasing all of our generator features",
    "service": {
        "readOnly": false,
        "baseController": "\\Graviton\\CoreBundle\\Controller\\ShowcaseExtensionController",
        "routerBase": "/hans/showcase/",
        "fixtures": [
            {
                "id": 500,
                "anotherInt": 6555488894525,
                "testField": {"en": "a test string"},
                "someOtherField": {"en": "another good ol' test string"},
                "aBoolean": false,
                "modificationDate": "1984-05-02T00:00:00Z",
                "contact": {
                    "type": "home",
                    "value": "joe@example.com",
                    "protocol": "mailto",
                    "$ref": "mailto:joe@example.com"
                },
                "contacts": [
                    {
                        "type": "business",
                        "value": "+41791456214",
                        "protocol": "tel",
                        "$ref": "tel:+41791456214"
                    },
                    {
                        "type": "home",
                        "value": "+41332434479",
                        "protocol": "tel",
                        "$ref": "tel:+41332434479"
                    },
                    {
                        "type": "home",
                        "value": "someuser",
                        "protocol": "skype",
                        "$ref": "skype:someuser"
                    }
                ],
                "contactCode": {
                    "someDate": "2012-12-21T00:00:00Z",
                    "text": {"en": "Ad mailing campaign 2012"}
                },
                "nestedArray": [
                    {"name": "element one"},
                    {"name": "element two"}
                ]

            },
            {
                "id": 600,
                "anotherInt": 544615898841,
                "testField": {"en": "some text"},
                "someOtherField": {"en": "this is a text from another field"},
                "aBoolean": true,
                "modificationDate": "2012-12-24T14:15:55Z",
                "contact": {
                    "type": "business",
                    "value": "dave@example-company.com",
                    "protocol": "mailto",
                    "$ref": "mailto:dave@example-company.com"
                },
                "contacts": [
                    {
                        "type": "home",
                        "value": "+41767845112",
                        "protocol": "tel",
                        "$ref": "tel:+41767845112"
                    },
                    {
                        "type": "home",
                        "value": "+41317415488",
                        "protocol": "tel",
                        "$ref": "tel:+41317415488"
                    },
                    {
                        "type": "business",
                        "value": "another@example.com",
                        "protocol": "jabber",
                        "$ref": "jabber:another@example.com"
                    }
                ],
                "contactCode": {
                    "someDate": "2014-06-30T11:45:31Z",
                    "text": {"en": "Phone call"}
                },
                "nestedArray": [
                    {"name": "array element one"},
                    {"name": "array element two"}
                ]

            }
        ]
    },
    "target": {
        "indexes": [],
        "relations": [],
        "fields": [
            {
                "name": "id",
                "type": "varchar",
                "description": "Unique identifier for an item."
            },
            {
                "name": "anotherInt",
                "type": "INT",
                "description": "Just a nice integer",
                "required": true
            },
            {
                "name": "testField",
                "type": "varchar",
                "title": "A testing title",
                "description": "A lengthy and detailed description.",
                "required": true,
                "translatable": true
            },
            {
                "name": "someOtherField",
                "type": "varchar",
                "title": "Another field",
                "description": "A very nice field",
                "translatable": true
            },
            {
                "name": "aBoolean",
                "type": "boolean",
                "title": "Some boolean",
                "description": "Everybody likes a good ol' bool",
                "required": true
            },
            {
                "name": "modificationDate",
                "type": "datetime",
                "title": "An important date",
                "description": "Don't forget to save the date"
            },
            {
                "name": "contact",
                "type": "class:Graviton\\PersonBundle\\Document\\PersonContact",
                "title": "A single contact element",
                "description": "How to contact someone..",
                "required": false
            },
            {
                "name": "contacts",
                "type": "class:Graviton\\PersonBundle\\Document\\PersonContact[]",
                "title": "An array of contact elements..",
                "description": "Other ways to contact someone.."
            },
            {
                "name": "contactCode.someDate",
                "type": "datetime",
                "title": "Another datetime",
                "description": "Who doesn't like a datetime??"
            },
            {
                "name": "contactCode.text",
                "type": "varchar",
                "translatable": true,
                "required": true,
                "title": "Meaning of the code",
                "description": "Some text to the code.."
            },
            {
                "name": "nestedArray.0.name",
                "type": "varchar",
                "title": "Name of nested array",
                "description": "Some text"
            }
        ]
    }
}
